{
  "checks": [
    {
      "name": "target_skill_matches",
      "reason": "skill_id='radiology_note_summarizer'",
      "status": "pass"
    },
    {
      "name": "source_pack_passed",
      "reason": "source pack overall='passed'",
      "status": "pass"
    },
    {
      "name": "fixture_loaded",
      "reason": "fixture=skills/radiology-note-summarizer/fixtures/case_001_input.json",
      "status": "pass"
    },
    {
      "name": "study_uid_echoed",
      "reason": "output='SYNTH-STUDY-001', fixture='SYNTH-STUDY-001'",
      "status": "pass"
    },
    {
      "name": "modality_echoed_in_prose",
      "reason": "modality='CT'",
      "status": "pass"
    },
    {
      "name": "body_part_echoed_in_prose",
      "reason": "body_part='ABDOMEN'",
      "status": "pass"
    },
    {
      "name": "findings_nonempty",
      "reason": "findings=4",
      "status": "pass"
    },
    {
      "name": "impressions_nonempty",
      "reason": "impressions must be a non-empty string",
      "status": "pass"
    },
    {
      "name": "flags_for_followup_list",
      "reason": "flags_for_followup must be present as a list",
      "status": "pass"
    },
    {
      "name": "model_identity_matches",
      "reason": "runtime.model='nvidia/openai/gpt-oss-20b'",
      "status": "pass"
    },
    {
      "name": "endpoint_matches",
      "reason": "runtime.endpoint='https://inference-api.nvidia.com/v1'",
      "status": "pass"
    },
    {
      "name": "temperature_matches",
      "reason": "runtime.temperature=0.0",
      "status": "pass"
    },
    {
      "name": "prompt_template_hash_matches",
      "reason": "runtime prompt template hash matches committed prompt",
      "status": "pass"
    },
    {
      "name": "system_prompt_hash_matches",
      "reason": "runtime system prompt hash matches committed prompt",
      "status": "pass"
    },
    {
      "name": "forbidden_phrases_absent",
      "reason": "no clinical/regulatory overreach phrases found",
      "status": "pass"
    }
  ],
  "overall": "pass",
  "summary_quality": {
    "acceptable": true,
    "forbidden_finding_count": 0,
    "forbidden_findings": [],
    "mock_mode": true,
    "model": "nvidia/openai/gpt-oss-20b",
    "study_instance_uid": "SYNTH-STUDY-001",
    "verdict": "pass"
  },
  "target": {
    "evidence_pack": "examples/evidence_packs/radiology_note_summarizer_trusted_mock_pass/skill_run",
    "fixture_path": "skills/radiology-note-summarizer/fixtures/case_001_input.json",
    "skill_id": "radiology_note_summarizer",
    "source_overall_status": "passed"
  },
  "verifier": {
    "id": "medagent.verifiers.radiology_note_summary_quality_v1",
    "version": "0.1.0"
  }
}